{
  "schema": "agenomic.knowledge_retrieval_event/v1",
  "knowledge_base_id": null,
  "knowledge_version": null,
  "knowledge_manifest_digest": "sha256:ae6bb2e6b114c292988ffbcb43d937c21d8d0d69261eedc3becbb0a675a3d270",
  "knowledge_query_digest": "sha256:f5c0e807a84882af9aba47bd5e979a13fc9749eaef1ea9438c42fe5368f0b0a8",
  "knowledge_execution_key": "bnd:bnd_01hzy8m6k2v9qf7c3n5t0r4wxa",
  "knowledge_refs": [
    {
      "kb_id": "kb_customer_support",
      "version": 4,
      "version_manifest_digest": "sha256:ddb9172866e9cddeeca6798c5d8b9575d057c8372975163c95a10efdfda88187",
      "document_id": "kdoc_01hzy8m6k2v9qf7c3n5t0r4wxa",
      "section_id": "sec_41672fa1b7ad29af",
      "chunk_id": null,
      "content_digest": "sha256:e98e806676da331440ccb1f1c03edccd270d1356b6bc90efbce610ba4c7d9b6c",
      "rank": 1,
      "score_ppm": 1000000
    }
  ]
}
